"324",2.01205e+11,2012,5,20,"",0,"",217,"United States",1,"North America","Virginia","Axton",36.659582,-79.711978,1,0,"","05/20/2012: Assailants set fire to the New Holy Deliverance Outreach Ministry in Axton, Virginia, United States. There were no reported casualties in the attack. An individual, identified as Jean-Claude Bridges, claimed responsibility for the incident and stated that he targeted the church because the congregation was predominantly African American.",1,1,1,0,NA,".",0,1,0,7,"Facility/Infrastructure Attack",NA,".",NA,".",15,"Religious Figures/Institutions",86,"Place of Worship","New Holy Deliverance Outreach Ministry","Church",217,"United States",NA,".",NA,".","","",NA,".",NA,".",NA,".","","",NA,".","Unaffiliated Individual(s)","","","","",20202,NA,NA,"","An individual, identified as Jean-Claude Bridges, claimed responsibility for the incident and stated that he targeted New Holy Deliverance Outreach Ministry because the church's congregation was predominantly African American.",0,NA,NA,2,1,1,8,"Personal claim",NA,NA,".",NA,NA,".",NA,8,"Incendiary",18,"Arson/Fire",NA,".",NA,".",NA,".",NA,".",NA,".",NA,".","",0,0,0,0,0,0,1,3,"Minor (likely < $1 million)",-99,"A church was damaged in this attack.",0,NA,NA,NA,NA,"","",NA,NA,NA,NA,NA,"",NA,".",NA,"","""Virginia church set on fire because congregants are black,"" WTVR CBS, January 9, 2013.","""Virginia Teen, Charged as Adult, Sentenced for Church Arson,"" Department of Justice, Office of Public Affairs, May 2, 2013.","","START Primary Collection",-9,-9,0,-9,""
"325",2.01205e+11,2012,5,23,"",0,"",217,"United States",1,"North America","Georgia","Marietta",33.912749,-84.467353,1,0,"","05/23/2012: Assailants set fire to the Alpha OB/GYN clinic in Marietta, Georgia, United States. There were no reported casualties in the attack. No group claimed responsibility for the incident.",1,1,1,0,NA,".",0,1,0,7,"Facility/Infrastructure Attack",NA,".",NA,".",5,"Abortion Related",40,"Clinics","Alpha OB/GYN","Clinic",217,"United States",NA,".",NA,".","","",NA,".",NA,".",NA,".","","",NA,".","Unknown","","","","",-9,NA,NA,"","The specific motive is unknown; however, sources noted that the owner of Alpha OB/GYN clinic is known for providing abortions.",0,NA,NA,2,0,0,NA,".",NA,NA,".",NA,NA,".",NA,8,"Incendiary",18,"Arson/Fire",NA,".",NA,".",NA,".",NA,".",NA,".",NA,".","",0,0,0,0,0,0,1,3,"Minor (likely < $1 million)",-99,"An OBGYN clinic building was damaged in this attack.",0,NA,NA,NA,NA,"","",NA,NA,NA,NA,NA,"",NA,".",NA,"","""FBI seeks possible witness in OB/GYN clinic fire,"" WSB-TV 2 Atlanta, May 23, 2012.","""Georgia Abortion Clinic Fires Investigated By FBI,"" Huffington Post, May 24, 2012.","""Information Sought Concerning Intentional Fires at Two Clinics,"" Department of Justice Documents, May 23, 2012.","START Primary Collection",-9,-9,0,-9,""
"326",2.01205e+11,2012,5,31,"",0,"",130,"Mexico",1,"North America","Michoacan","Unknown",19.566519,-101.706829,4,0,"","05/31/2012: Assailants opened fire on a delivery truck in Michoacan state, Mexico. The truck was destroyed and the driver injured in the attack. The Knights Templar (Caballeros Templarios) claimed responsibility for the incident. According to banners hung by the group, the trucks were burned because the group believed they were helping transport government intelligence agents.",0,1,1,1,2,"Other Crime Type",0,1,0,7,"Facility/Infrastructure Attack",NA,".",NA,".",1,"Business",7,"Retail/Grocery/Bakery","Sabritas Snack Company","Delivery truck",130,"Mexico",NA,".",NA,".","","",NA,".",NA,".",NA,".","","",NA,".","Knights Templar (Caballeros Templarios)","","","","",40051,NA,NA,"","According to banners hung by the Knights Templar (Caballeros Templarios), the trucks were burned because the group believed they were helping transport government intelligence agents.",0,NA,NA,-99,0,1,10,"Unknown",NA,NA,".",NA,NA,".",NA,8,"Incendiary",18,"Arson/Fire",NA,".",NA,".",NA,".",NA,".",NA,".",NA,".","",0,0,0,1,0,0,1,3,"Minor (likely < $1 million)",-99,"One PepsiCo delivery truck was damaged in this attack.",0,NA,NA,NA,NA,"","",NA,NA,NA,NA,NA,"",NA,".",NA,"There is doubt that this incident meets terrorism-related criteria. It is unclear whether there was a larger political goal since the attack was carried out by the Knights Templar (Caballeros Templarios), a drug cartel.","""Gunmen attack Pepsi subsidiary vehicle in Mexico,"" Agence France Presse -- English, June 1, 2012.","""Gang attacks Mexico PepsiCo subsidiary again,"" Associated Press Online, June 1, 2012.","","START Primary Collection",0,0,0,0,""
"327",2.01206e+11,2012,6,2,"",0,"",130,"Mexico",1,"North America","Tamaulipas","Matamoros",25.869029,-97.502738,1,0,"","06/02/2012: Assailants threw a hand grenade near the Televisa studios in Matamoros city, Tamaulipas state, Mexico. The device failed to detonate and was safely removed without causing injury. No group claimed responsibility for the incident; however, sources suspected that the attack was connected to a Zeta campaign.",0,1,1,1,2,"Other Crime Type",0,0,0,3,"Bombing/Explosion",NA,".",NA,".",10,"Journalists & Media",55,"Television Journalist/Staff/Facility","Televisa","Television Studio",130,"Mexico",NA,".",NA,".","","",NA,".",NA,".",NA,".","","",NA,".","Unknown","","","","",-9,NA,NA,"","",0,NA,NA,-99,0,0,NA,".",NA,NA,".",NA,NA,".",NA,6,"Explosives/Bombs/Dynamite",7,"Grenade",NA,".",NA,".",NA,".",NA,".",NA,".",NA,".","",0,0,0,0,0,0,0,NA,".",NA,"",0,NA,NA,NA,NA,"","",NA,NA,NA,NA,NA,"",NA,".",NA,"There is doubt that this incident meets terrorism-related criteria. Sources stated that the attack was meant to limit the activity of the Gulf Cartel, a rival group of the Zetas.","""Grenades used in Mexico serve to scare more than kill,"" The Monitor (MCT), June 21, 2012.","","","START Primary Collection",-9,-9,0,-9,""
"328",2.01206e+11,2012,6,13,"",1,"6/14/2012",130,"Mexico",1,"North America","Veracruz","Xalapa",19.530476,-96.909131,1,0,"","06/13/2012: Assailants kidnapped Victor Manuel Baez Chino outside of his workplace in Xalapa city, Veracruz state, Mexico. Baez Chino, a journalist with Milenio Newspaper, was discovered dead the next day. The Zetas claimed responsibility for the incident, stating that the journalist had betrayed the group.",0,1,1,1,2,"Other Crime Type",0,1,0,6,"Hostage Taking (Kidnapping)",NA,".",NA,".",10,"Journalists & Media",53,"Newspaper Journalist/Staff/Facility","Milenio Newspaper","Journalist: Victor Manuel Baez Chino",130,"Mexico",NA,".",NA,".","","",NA,".",NA,".",NA,".","","",NA,".","Zetas","","","","",40024,NA,NA,"","According to a note left on the corpse of the victim, the Zetas killed the victim because he had betrayed the group.  Sources speculated that the victim, a newspaper journalist, may have been killed because of his reporting on drug crime.",0,NA,NA,-99,0,1,5,"Note left at scene",NA,NA,".",NA,NA,".",NA,5,"Firearms",5,"Unknown Gun Type",NA,".",NA,".",NA,".",NA,".",NA,".",NA,".","",1,0,0,0,0,0,0,NA,".",NA,"",1,1,0,NA,1,"","",0,NA,NA,NA,NA,"",4,"Hostage(s) killed (not during rescue attempt)",0,"There is doubt that this incident meets terrorism-related criteria. Sources suspect that the Zetas killed the journalist due to his reporting on drug activity, suggesting that this was a purely criminal act.","""Mexican crime reporter killed in Veracruz state,"" Associated Press Online, June 14, 2012.","""Mexican reporter killed, fifth to die since late April,"" Associated Press Newswires, June 15, 2012.","""MEXICO: CRIME REPORTER IS KILLED,"" The New York Times Abstracts, June 15, 2012.","START Primary Collection",0,0,0,0,""
"329",2.01206e+11,2012,6,18,"",0,"",217,"United States",1,"North America","Texas","Plano",33.019843,-96.698886,1,0,"","06/18/2012: An assailant attempted to bomb a natural gas pipeline in Plano, Texas, United States. The assailant was critically injured when the explosive device detonated prematurely. Additionally, the pipeline was also damaged in the blast. No group claimed responsibility; however, sources note that Anson Chi identified as part of the anti-government Sovereign Citizen movement.",1,1,1,0,NA,".",0,1,0,3,"Bombing/Explosion",NA,".",NA,".",21,"Utilities",106,"Gas","Atmos Energy","Gas Pipeline",217,"United States",NA,".",NA,".","","",NA,".",NA,".",NA,".","","",NA,".","Sovereign Citizen","","","","",40377,NA,NA,"","The specific motive is unknown; however, the assailant, Anson Chi, had posted YouTube videos and blog entries describing his dislike for the government and the police.",0,NA,NA,1,1,0,NA,".",NA,NA,".",NA,NA,".",NA,6,"Explosives/Bombs/Dynamite",17,"Other Explosive Type",NA,".",NA,".",NA,".",NA,".",NA,".",NA,".","A homemade bomb containing methyl nitrate was used in the attack.",0,0,0,1,0,1,1,3,"Minor (likely < $1 million)",-99,"A natural gas pipeline was damaged in this attack.",0,NA,NA,NA,NA,"","",NA,NA,NA,NA,NA,"",NA,".",NA,"","""Texas man pleads guilty to trying to blow up natural gas pipeline, possessing homemade bomb,"" Associated Press Newswires, June 3, 2013.","""Plano Bombing Suspect Takes Plea Deal,"" NBC Dallas-Fort Worth, June 3, 2013.","""Sovereign Extremist Injured in Texas Bomb Explosion,"" Forbes, July 3, 2012.","START Primary Collection",0,0,0,0,""
"330",2.01206e+11,2012,6,22,"6/22/2012 0:00",0,"",130,"Mexico",1,"North America","Tamaulipas","Ciudad Victoria",23.737156,-99.143987,1,0,"","06/22/2012: Two severed heads were placed outside Ciudad Victoria's city hall in Tamaulipas state, Mexico. The heads each had a Z carved into the skin. The date that the victims were killed and their identities are unknown. No group claimed responsibility for the incident; however, according to a sign left at the scene of the event, city officials were warned to stop cooperating with the Zetas.",0,1,1,1,2,"Other Crime Type",0,1,0,2,"Armed Assault",NA,".",NA,".",14,"Private Citizens & Property",67,"Unnamed Civilian/Unspecified","Not Applicable","Civilians",130,"Mexico",NA,".",NA,".","","",NA,".",NA,".",NA,".","","",NA,".","Unknown","","","","",-9,NA,NA,"","The specific motive is unknown; however, a banner was found near the site that warned city officials not to cooperate with the Zetas cartel.",0,NA,NA,-99,0,0,NA,".",NA,NA,".",NA,NA,".",NA,9,"Melee",23,"Knife or Other Sharp Object",NA,".",NA,".",NA,".",NA,".",NA,".",NA,".","",2,0,0,0,0,0,0,NA,".",NA,"",0,NA,NA,NA,NA,"","",NA,NA,NA,NA,NA,"",NA,".",NA,"There is doubt that this incident meets terrorism-related criteria. Sources suspected that the attack was the result of fighting between rival drug cartels.","""BYLINE:   The Monitor, McAllen, Texas,"" The Monitor (McAllen, Texas), June 23, 2012.","","","START Primary Collection",-9,-9,0,-9,""
"331",2.01207e+11,2012,7,4,"",0,"",217,"United States",1,"North America","Missouri","Joplin",37.084227,-94.513281,1,0,"","07/04/2012: An assailant threw an incendiary device onto the roof of a mosque owned by the Islamic Society of Joplin in Joplin, Missouri, United States. No casualties were reported in the attack; however, the roof was damaged. This same mosque was later destroyed by arson on August 6, 2012. On October 19, 2012, Jedediah Stout was arrested and confessed to both of the arson attacks on the Joplin mosque.",1,1,1,0,NA,".",0,1,0,7,"Facility/Infrastructure Attack",NA,".",NA,".",15,"Religious Figures/Institutions",86,"Place of Worship","Islamic Society of Joplin","Mosque",217,"United States",NA,".",NA,".","","",NA,".",NA,".",NA,".","","",NA,".","Unaffiliated Individual(s)","","","","",20202,NA,NA,"","",0,NA,NA,1,1,1,8,"Personal claim",NA,NA,".",NA,NA,".",NA,8,"Incendiary",18,"Arson/Fire",NA,".",NA,".",NA,".",NA,".",NA,".",NA,".","An incendiary device thrown on the buildings roof was used in the attack.",0,0,0,0,0,0,1,3,"Minor (likely < $1 million)",-99,"The roof of a mosque owned by the Islamic Society of Joplin was damaged in this attack.",0,NA,NA,NA,NA,"","",NA,NA,NA,NA,NA,"",NA,".",NA,"","""Missouri mosque destroyed in second fire in a month,"" CNN Wire, August 6, 2012.","""Man confesses to Missouri mosque and clinic fires, prosecutors say,"" Reuters News, October 22, 2013.","""Missouri mosque razed by second fire in weeks,"" Al Jazeera English, August 6, 2012.","START Primary Collection",-9,-9,0,-9,""
"332",2.01208e+11,2012,8,5,"",0,"",217,"United States",1,"North America","Wisconsin","Oak Creek",42.88585,-87.863136,1,0,"The incident occurred 15km south of Milwaukee","08/05/2012: Wade Michael Page attacked a Sikh temple in Oak Creek, Wisconsin, United States. At least six people were killed and four others wounded before Page was shot by a responding police officer and subsequently died from a self-inflicted gunshot wound. No group claimed responsibility for the incident; however, the assailant was a member of a white supremacist organization.",1,1,1,0,NA,".",0,1,0,2,"Armed Assault",NA,".",NA,".",15,"Religious Figures/Institutions",86,"Place of Worship","Sikh Temple of Wisconsin","Sikh Temple",217,"United States",NA,".",NA,".","","",NA,".",NA,".",NA,".","","",NA,".","Unaffiliated Individual(s)","","","","",20202,NA,NA,"","",0,NA,NA,1,0,0,NA,".",NA,NA,".",NA,NA,".",NA,5,"Firearms",5,"Unknown Gun Type",NA,".",NA,".",NA,".",NA,".",NA,".",NA,".","",7,6,1,4,4,0,0,NA,".",NA,"",0,NA,NA,NA,NA,"","",NA,NA,NA,NA,NA,"",NA,".",NA,"Casualty numbers conflict for this attack.","""3   shot   at temple remain in critical condition,"" The Associated Press State & Local Wire, August 6, 2012.","""(adding fresh inputs about the shooter's identity),"" Press Trust of India, August 6, 2012.","""Sikh temple shooter had white supremacist ties: FBI,"" Agence France Presse, August 6, 2012.","START Primary Collection",-9,-9,0,-9,""
"333",2.01208e+11,2012,8,6,"",0,"",217,"United States",1,"North America","Missouri","Joplin",37.084227,-94.513281,1,0,"","08/06/2012: Assailants set fire to a mosque owned by the Islamic Society of Joplin in Joplin, Missouri, United States. No one was hurt or killed in the attack, but the mosque was destroyed. No group claimed responsibility for this incident.",1,1,1,0,NA,".",0,1,0,7,"Facility/Infrastructure Attack",NA,".",NA,".",15,"Religious Figures/Institutions",86,"Place of Worship","Islamic Society of Joplin","Mosque",217,"United States",NA,".",NA,".","","",NA,".",NA,".",NA,".","","",NA,".","Unaffiliated Individual(s)","","","","",20202,NA,NA,"","",0,NA,NA,1,1,1,8,"Personal claim",NA,NA,".",NA,NA,".",NA,8,"Incendiary",18,"Arson/Fire",NA,".",NA,".",NA,".",NA,".",NA,".",NA,".","",0,0,0,0,0,0,1,3,"Minor (likely < $1 million)",-99,"A mosque was damaged in this attack.",0,NA,NA,NA,NA,"","",NA,NA,NA,NA,NA,"",NA,".",NA,"","""Man confesses to Missouri mosque and clinic fires, prosecutors say,"" Reuters News, October 22, 2013.","""Missouri mosque razed by second fire in weeks,"" Al Jazeera English, August 6, 2012.","""Mosque destroyed in US   arson attack,"" The Peninsula, August 7, 2012.","START Primary Collection",-9,-9,0,-9,""
"334",2.01208e+11,2012,8,12,"",0,"",217,"United States",1,"North America","Illinois","Lombard",41.880028,-88.007845,1,0,"","08/12/2012: Assailants threw an explosive device containing acid and other chemicals at the College Preparatory School of America, an Islamic school, in Lombard, Illinois, United States. There were no casualties or property damage reported in this incident. No group claimed responsibility for this attack.",1,1,1,0,NA,".",0,1,0,3,"Bombing/Explosion",NA,".",NA,".",8,"Educational Institution",49,"School/University/Educational Building","College Preparatory School of America","Islamic School",217,"United States",NA,".",NA,".","","",NA,".",NA,".",NA,".","","",NA,".","Unknown","","","","",-9,NA,NA,"","",0,NA,NA,-99,0,0,NA,".",NA,NA,".",NA,NA,".",NA,6,"Explosives/Bombs/Dynamite",17,"Other Explosive Type",NA,".",NA,".",NA,".",NA,".",NA,".",NA,".","A thrown homemade bomb containing acid and other chemicals was used in the attack.",0,0,0,0,0,0,1,3,"Minor (likely < $1 million)",-99,"A building was damaged in this attack.",0,NA,NA,NA,NA,"","",NA,NA,NA,NA,NA,"",NA,".",NA,"","""Police in suburban Chicago probing attack on Islamic school,"" Reuters News, August 13, 2012.","""Air   rifle shots fired   at mosque north of Chicago,"" The Associated Press State & Local Wire, August 11, 2012.","""Homemade bomb goes off outside Muslim school,"" Chicago Daily Herald, August 14, 2012.","START Primary Collection",-9,-9,0,-9,""
"335",2.01208e+11,2012,8,15,"",0,"",217,"United States",1,"North America","District of Columbia","Washington",38.895112,-77.036366,1,0,"","08/15/2012: An assailant opened fire on a security guard at the offices of the Family Research Council in Washington, District of Columbia (DC), United States. One security guard was wounded in the attack; the assailant was arrested. Floyd Corkins claimed responsibility for the attack, stating that he targeted the Family Research Council because of the organization's opposition to gay marriage and gay rights.",1,1,1,0,NA,".",0,1,0,2,"Armed Assault",NA,".",NA,".",12,"NGO",61,"Domestic NGO","Family Research Council","Security Guard",217,"United States",NA,".",NA,".","","",NA,".",NA,".",NA,".","","",NA,".","Unaffiliated Individual(s)","","","","",20202,NA,NA,"","In a guilty plea entered in court as part of a plea agreement, Floyd Corkins stated that he targeted the Family Research Council because of the organization's opposition to gay marriage and gay rights.",0,NA,NA,1,1,1,8,"Personal claim",NA,NA,".",NA,NA,".",NA,5,"Firearms",3,"Handgun",NA,".",NA,".",NA,".",NA,".",NA,".",NA,".","",0,0,0,1,1,0,0,NA,".",NA,"",0,NA,NA,NA,NA,"","",NA,NA,NA,NA,NA,"",NA,".",NA,"","""Man guilty in Family   Research   Council shooting,"" The Associated Press, February 6, 2013.","""Family Research Council security guard   shot   by   gunman   at DC headquarters,"" Guardian Unlimited, August 16, 2012.","""Plea is first under D.C. terrorism act of '02;  Man admits plan for mass killings,"" The Washington Times, February 7, 2013.","START Primary Collection",-9,-9,0,-9,""
"336",2.01209e+11,2012,9,30,"",0,"",217,"United States",1,"North America","Ohio","Perrysburg",41.528165,-83.618569,1,0,"The incident occurred at the Islamic Center of Greater Toledo.","09/30/2012: Randolph T. Linn set fire to the area where men pray in the main room of the Islamic Center of Greater Toledo in Perrysburg city, Ohio, United States. Sprinklers were able to douse the fire, but significant damage to the center was done. No group claimed responsibility for the incident.",1,1,1,0,NA,".",0,1,0,7,"Facility/Infrastructure Attack",NA,".",NA,".",15,"Religious Figures/Institutions",86,"Place of Worship","Islamic Center of Greater Toledo","Prayer Room",217,"United States",NA,".",NA,".","","",NA,".",NA,".",NA,".","","",NA,".","Unaffiliated Individual(s)","","","","",20202,NA,NA,"","",0,NA,NA,1,1,0,NA,".",NA,NA,".",NA,NA,".",NA,5,"Firearms",5,"Unknown Gun Type",8,"Incendiary",20,"Gasoline or Alcohol",NA,".",NA,".",NA,".",NA,".","",0,0,0,0,0,0,1,3,"Minor (likely < $1 million)",-99,"Water damage rendered the space unusable for three months",0,NA,NA,NA,NA,"","",NA,NA,NA,NA,NA,"",NA,".",NA,"","""Suspected arsonist faces charges over mosque burning,"" CNN Wire, October 4, 2012.","""Non-Muslims send help after mosque is damaged,"" The Christian Century, October 31, 2012.","","START Primary Collection",-9,-9,0,-9,""
"337",2.01211e+11,2012,11,2,"",0,"",38,"Canada",1,"North America","Vancouver","Surrey",49.186495,-122.823134,1,0,"","11/02/2012: At least one explosive device was discovered on the track of the SkyTrain in Surrey city, British Colombia province, Canada. The device was safely removed and control-detonated without causing injury. No group claimed responsibility for the incident.",1,1,1,0,NA,".",0,0,0,3,"Bombing/Explosion",NA,".",NA,".",19,"Transportation",102,"Subway","Metro Vancouver","SkyTrain",38,"Canada",NA,".",NA,".","","",NA,".",NA,".",NA,".","","",NA,".","Unknown","","","","",-9,NA,NA,"","",0,NA,NA,-99,0,0,NA,".",NA,NA,".",NA,NA,".",NA,6,"Explosives/Bombs/Dynamite",16,"Unknown Explosive Type",NA,".",NA,".",NA,".",NA,".",NA,".",NA,".","An explosive device consisting of three canisters taped together was used in the attack.",0,0,0,0,0,0,0,NA,".",NA,"",0,NA,NA,NA,NA,"","",NA,NA,NA,NA,NA,"",NA,".",NA,"","""Vancouver's SkyTrain system faces new attacks after bomb scare,"" The Canadian Press, November 9, 2012.","""Two more bomb scares \ Transit passengers reporting more unidentified objects to authorities,"" 24 hours Vancouver, November 7, 2012.","""Extra security added following bomb scare \ Transit police unaware of possible motive or suspect,"" 24 hours Vancouver, November 5, 2012.","START Primary Collection",-9,-9,0,-9,""
"338",2.01211e+11,2012,11,30,"",0,"",130,"Mexico",1,"North America","Federal","Mexico City",19.343744,-99.156188,1,0,"","11/30/3012: An explosive device detonated at an automated teller machine (ATM) in Coyoacan neighborhood, Mexico City, Federal, Mexico. There were no reported injuries resulting from the blast, although the building was damaged. There were political pamphlets left at the site of the explosion indicating that the attack was perpetrated by a far-left group.",1,1,1,0,NA,".",0,1,0,3,"Bombing/Explosion",NA,".",NA,".",1,"Business",3,"Bank/Commerce","Unknown","Automated Teller Machine (ATM)",130,"Mexico",NA,".",NA,".","","",NA,".",NA,".",NA,".","","",NA,".","Unknown","","","","",-9,NA,NA,"","",0,NA,NA,-99,0,0,NA,".",NA,NA,".",NA,NA,".",NA,6,"Explosives/Bombs/Dynamite",17,"Other Explosive Type",NA,".",NA,".",NA,".",NA,".",NA,".",NA,".","A homemade explosive device constructed from a gas spray can and placed inside an ATM machine was used in the attack.",0,0,0,0,0,0,1,3,"Minor (likely < $1 million)",-99,"The building and ATM were damaged in this attack.",0,NA,NA,NA,NA,"","",NA,NA,NA,NA,NA,"",NA,".",NA,"","""Homemade explosives hit two Mexico ATM machines,"" Agence France Presse -- English, November 30, 2012.","","","START Primary Collection",-9,-9,0,-9,""
"339",2.01211e+11,2012,11,30,"",0,"",217,"United States",1,"North America","Arizona","Casa Grande",32.879502,-111.757352,1,0,"","11/30/2012: A small incendiary device exploded at the entrance of a Social Security Administration building in Casa Grande town, Arizona, United States. No one was injured in the blast, although the building was slightly damaged. An Iraqi civilian, Abdullatif Ali Aldosary, was taken into custody in connection with the incident.",1,1,1,0,NA,".",0,1,0,7,"Facility/Infrastructure Attack",NA,".",NA,".",2,"Government (General)",21,"Government Building/Facility/Office","Social Security Administration","Building",217,"United States",NA,".",NA,".","","",NA,".",NA,".",NA,".","","",NA,".","Unaffiliated Individual(s)","","","","",20202,NA,NA,"","Specific motive is unknown; however, the man who was taken into custody for the firebombing had been denied a green card due to his anti-government activities in Iraq.",0,NA,NA,-99,1,0,NA,".",NA,NA,".",NA,NA,".",NA,8,"Incendiary",19,"Molotov Cocktail/Petrol Bomb",NA,".",NA,".",NA,".",NA,".",NA,".",NA,".","A firebomb containing a mixture of flammable chemicals was used in the attack.",0,0,0,0,0,0,1,3,"Minor (likely < $1 million)",-99,"The door of the building was damaged in this attack.",0,NA,NA,NA,NA,"","",NA,NA,NA,NA,NA,"",NA,".",NA,"","""UPDATE 2-Suspect in custody in firebombing of Arizona federal building,"" Reuters News, November 30, 2012.","""No injuries following small explosion outside Social Security office in southern Arizona town,"" Associated Press Newswires, November 30, 2012.","""Source: Man held after blast outside Social Security building in Arizona,"" CNN Wire, November 30, 2012.","START Primary Collection",-9,-9,0,-9,""
"340",2.01301e+11,2013,1,5,"",0,"",38,"Canada",1,"North America","British Columbia","Vancouver",49.282729,-123.120737,1,0,"","01/05/2013: Assailants threw an incendiary device at a Royal Canadian Mounted Police (RCMP) vehicle in Vancouver, Canada. There were no reported casualties in the attack. The Animal Liberation Front (ALF) claimed responsibility for the incident and stated that the victim was targeted for owning a fur store.",1,1,1,0,NA,".",0,0,0,7,"Facility/Infrastructure Attack",NA,".",NA,".",3,"Police",23,"Police Patrol (including vehicles and convoys)","Royal Canadian Mounted Police (RCMP)","Vehicle",38,"Canada",NA,".",NA,".","","",NA,".",NA,".",NA,".","","",NA,".","Animal Liberation Front (ALF)","","","","",291,NA,NA,"","The Animal Liberation Front (ALF) claimed responsibility for the incident and stated that the victim was targeted for owning a fur store.",0,NA,NA,-99,0,1,4,"E-mail",NA,NA,".",NA,NA,".",NA,8,"Incendiary",20,"Gasoline or Alcohol",NA,".",NA,".",NA,".",NA,".",NA,".",NA,".","A Molotov cocktail was used in the attack.",0,0,0,0,0,0,0,NA,".",NA,"",0,NA,NA,NA,NA,"","",NA,NA,NA,NA,NA,"",NA,".",NA,"","""Animal rights extremists throw Molotov cocktail at VPD cruiser,"" CTV News, January 9, 2013.","","","START Primary Collection",0,1,0,1,""
