"208",2.00703e+11,2007,3,17,"",0,"",130,"Mexico",1,"North America","Nuevo Leon (State)","Monterrey",25.673211,-100.309201,1,0,"","03/17/2007: In an ongoing series of attacks on Monterrey, Mexico, civilians and police officers, 10 were killed by gang violence possibly meant to intimidate police officers.  No claim of responsibility was reported.",1,1,1,0,NA,".",0,1,0,2,"Armed Assault",NA,".",NA,".",3,"Police",25,"Police Security Forces/Officers","Monterrey Police","Five police officers in Monterrey",130,"Mexico",14,"Private Citizens & Property",67,"Unnamed Civilian/Unspecified","Civilians","Monterrey",130,"Mexico",NA,".",NA,".","","",NA,".","Unknown","","","","",-9,NA,NA,"","Unknown",0,NA,NA,NA,0,0,NA,".",NA,NA,".",NA,NA,".",NA,5,"Firearms",5,"Unknown Gun Type",NA,".",NA,".",NA,".",NA,".",NA,".",NA,".","",10,0,0,NA,0,0,0,NA,".",NA,"",0,NA,NA,NA,NA,"","",NA,NA,NA,NA,NA,"",NA,".",NA,"","""Monterrey Reeling as 10 Slain in Week of Bloody Cartel Battles,” San Antonio Express-News, March 17, 2007.","","","CETIS",-9,-9,0,-9,""
"209",2.00703e+11,2007,3,18,"",0,"",217,"United States",1,"North America","Colorado","Denver",39.730615,-104.8987,1,0,"7700 block of East Eighth Place in Cherry Creek area of Denver","3/18/2007: Grant Barnes, suspectedly affiliated with the Earth Liberation Front (ELF), planted an incendiary device near a parked 2007 Chevrolet Suburban at the 700 block of East 8th Place in the Cherry Creek neighborhood of Denver, Colorado in the United States.  A second incendiary was also found near another SUV on this day. These devices did not detonate, thus, no damage or injuries were caused in the incident.  However, these were two in a series of seven firebombs which Barnes planted in the Cherry Creek area, targeting SUVs over the course of four days.  Two of the other devices exploded.  Barnes was arrested on March 22, 2007, indicted, and pled guilty in July  2007, and sentenced to 12 years in prison.",1,1,1,0,NA,".",0,0,0,7,"Facility/Infrastructure Attack",NA,".",NA,".",14,"Private Citizens & Property",73,"Vehicles/Transportation","","Sports utility vehicles owned by private citizens",217,"United States",NA,".",NA,".","","",NA,".",NA,".",NA,".","","",NA,".","Earth Liberation Front (ELF)","","","","",20147,NA,NA,"","Specific motive is unknown, but is suspected to be environmentalist-related.",1,NA,NA,1,1,0,NA,".",NA,NA,".",NA,NA,".",NA,8,"Incendiary",20,"Gasoline or Alcohol",NA,".",NA,".",NA,".",NA,".",NA,".",NA,".","",0,0,0,0,0,0,0,NA,".",NA,"",0,NA,NA,NA,NA,"","",0,NA,NA,NA,NA,"",NA,".",NA,"These were two in a series of seven firebombs which Barnes planted in the Cherry Creek area, targeting SUVs over the course of four days.  Two of the other devices exploded.  Barnes was arrested on March 22, 2007, indicted, and pled guilty in July  2007, and sentenced to 12 years in prison. At the time of his arrest, authorities discovered seven improvised incendiary devices, similar to those found under the vehicles, and gas cans, a box of long matches, a face mask and disposable gloves in Barnes' car.  The devices were similar to those used by ELF and ALF in past  SUV fire bombings, and the making of the devices was described on ALF's website. Authorities were unable to confirm a connection between Barnes and ELF/ALF.","Howard Pankratz, ""Man held in SUV sabotage FIREBOMBS FOUND UNDER 7 Similar devices were discovered in the car of Grant Barnes, suspected of attempting to detonate them in Cherry Creek over a four-day span,"" The Denver Post, April 5, 2007.","Howard Pankratz, ""Devices ""identical"" to extremist group's CHERRY CREEK FIREBOMBINGS Investigators will search a suspect's computer for ties to ecoterror groups. Grant Barnes is accused of trying to set off firebombs under 7 SUVs in March,"" The Denver Post, May 22, 2007.","""Man accused of SUV bombings pleads guilty, sentenced to 12 years,"" Associated Press, July 26, 2007.","Eco Project 2010",0,1,0,1,""
"210",2.00703e+11,2007,3,20,"",0,"",217,"United States",1,"North America","Colorado","Denver",39.720689,-104.947647,1,0,"residence in Cherry Creek area of Denver","3/20/2007: Grant Barnes, suspectedly affiliated with the Earth Liberation Front (ELF), planted an incendiary device under a parked 1996 Chevrolet Tahoe in the driveway of Josh and Jennifer Rudolph's home in the Cherry Creek neighborhood of Denver, Colorado in the United States.  The SUV sustained heavy fire damage, but there were no casualties in the incident.  Two more devices were discovered, targeting other SUVs in the area on this day.   These were three in a series of seven firebombs which Barnes planted in the Cherry Creek area, targeting SUVs over the course of four days. Barnes was arrested on March 22, 2007, indicted, and pled guilty in July  2007, and sentenced to 12 years in prison.",1,1,1,0,NA,".",0,1,0,7,"Facility/Infrastructure Attack",NA,".",NA,".",14,"Private Citizens & Property",73,"Vehicles/Transportation","Josh and Jennifer Rudolph","Sports utility vehicle owned by private citizens, Josh and Jennifer Rudolph",217,"United States",NA,".",NA,".","","",NA,".",NA,".",NA,".","","",NA,".","Earth Liberation Front (ELF)","","","","",20147,NA,NA,"","Specific motive is unknown, but is suspected to be environmentalist-related.",1,NA,NA,1,1,0,NA,".",NA,NA,".",NA,NA,".",NA,8,"Incendiary",19,"Molotov Cocktail/Petrol Bomb",NA,".",NA,".",NA,".",NA,".",NA,".",NA,".","molotov cocktail-like devices consisting of a canister filled with gasoline",0,0,0,0,0,0,1,4,"Unknown",NA,"vehicles heavily damaged",0,NA,NA,NA,NA,"","",0,NA,NA,NA,NA,"",NA,".",NA,"These were three in a series of seven firebombs which Barnes planted in the Cherry Creek area, targeting SUVs over the course of four days.  Two of the seven devices exploded.  Barnes was arrested on March 22, 2007, indicted, and pled guilty in July  2007, and sentenced to 12 years in prison. At the time of his arrest, authorities discovered seven improvised incendiary devices, similar to those found under the vehicles, and gas cans, a box of long matches, a face mask and disposable gloves in Barnes' car.  The devices were similar to those used by ELF and ALF in past  SUV fire bombings, and the making of the devices was described on ALF's website. Authorities were unable to confirm a connection between Barnes and ELF/ALF.","Howard Pankratz, ""Man held in SUV sabotage FIREBOMBS FOUND UNDER 7 Similar devices were discovered in the car of Grant Barnes, suspected of attempting to detonate them in Cherry Creek over a four-day span,"" The Denver Post, April 5, 2007.","Howard Pankratz, ""Devices ""identical"" to extremist group's CHERRY CREEK FIREBOMBINGS Investigators will search a suspect's computer for ties to ecoterror groups. Grant Barnes is accused of trying to set off firebombs under 7 SUVs in March,"" The Denver Post, May 22, 2007.","""Man accused of SUV bombings pleads guilty, sentenced to 12 years,"" Associated Press, July 26, 2007.","Eco Project 2010",0,1,0,1,""
"211",2.00703e+11,2007,3,21,"",0,"",217,"United States",1,"North America","Colorado","Denver",39.71308,-104.944989,1,0,"200 block of South Monroe Street in the Cherry Creek area of Denver","3/21/2007: Grant Barnes, suspectedly affiliated with the Earth Liberation Front (ELF), used an incendiary device to set arson to a Hummer H2 parked in the 200 block of South Monroe Street in the Cherry Creek neighborhood of Denver, Colorado in the United States.  The SUV and a Chevrolet Avalanche, parked next to it, sustained heavy fire damage, but there were no casualties in the incident.  The letters ""ELF"" were written on the Hummer H2, seemingly in marker. One more device was discovered, targeting another SUV in the area on this day.  These were two in a series of seven firebombs which Barnes planted in the Cherry Creek area, targeting SUVs over the course of four days. Barnes was arrested on March 22, 2007, indicted, and pled guilty in July  2007, and sentenced to 12 years in prison.",1,1,1,0,NA,".",0,1,0,7,"Facility/Infrastructure Attack",NA,".",NA,".",14,"Private Citizens & Property",73,"Vehicles/Transportation","","Sports utility vehicles owned by private citizens",217,"United States",NA,".",NA,".","","",NA,".",NA,".",NA,".","","",NA,".","Earth Liberation Front (ELF)","","","","",20147,NA,NA,"","Specific motive is unknown, but is suspected to be environmentalist-related.",1,NA,NA,1,1,1,5,"Note left at scene",NA,NA,".",NA,NA,".",NA,8,"Incendiary",20,"Gasoline or Alcohol",NA,".",NA,".",NA,".",NA,".",NA,".",NA,".","",0,0,0,0,0,0,1,4,"Unknown",NA,"vehicles heavily damaged",0,NA,NA,NA,NA,"","",0,NA,NA,NA,NA,"",NA,".",NA,"These were two in a series of seven firebombs which Barnes planted in the Cherry Creek area, targeting SUVs over the course of four days.  Two of the seven devices exploded.  Barnes was arrested on March 22, 2007, indicted, and pled guilty in July  2007, and sentenced to 12 years in prison. At the time of his arrest, authorities discovered seven improvised incendiary devices, similar to those found under the vehicles, and gas cans, a box of long matches, a face mask and disposable gloves in Barnes' car.  The devices were similar to those used by ELF and ALF in past  SUV fire bombings, and the making of the devices was described on ALF's website. Authorities were unable to confirm a connection between Barnes and ELF/ALF.","Howard Pankratz, ""Man held in SUV sabotage FIREBOMBS FOUND UNDER 7 Similar devices were discovered in the car of Grant Barnes, suspected of attempting to detonate them in Cherry Creek over a four-day span,"" The Denver Post, April 5, 2007.","Howard Pankratz, ""Devices ""identical"" to extremist group's CHERRY CREEK FIREBOMBINGS Investigators will search a suspect's computer for ties to ecoterror groups. Grant Barnes is accused of trying to set off firebombs under 7 SUVs in March,"" The Denver Post, May 22, 2007.","""Man accused of SUV bombings pleads guilty, sentenced to 12 years,"" Associated Press, July 26, 2007.","Eco Project 2010",0,1,0,1,""
"212",2.00703e+11,2007,3,23,"",0,"",130,"Mexico",1,"North America","Nuevo Leon (State)","Monterrey",25.673211,-100.309201,1,0,"","03/23/2007: A Mexican police official was shot in connection to a drug cartel in Monterrey, Mexico.  No claim of responsibility was reported.",1,1,1,0,NA,".",0,1,0,2,"Armed Assault",NA,".",NA,".",3,"Police",25,"Police Security Forces/Officers","Monterrey Police","A police officer in Monterrey",130,"Mexico",NA,".",NA,".","","",NA,".",NA,".",NA,".","","",NA,".","Unknown","","","","",-9,NA,NA,"","Unknown",0,NA,NA,NA,NA,0,NA,".",NA,NA,".",NA,NA,".",NA,5,"Firearms",5,"Unknown Gun Type",NA,".",NA,".",NA,".",NA,".",NA,".",NA,".","",1,0,0,NA,0,0,0,NA,".",NA,"",0,NA,NA,NA,NA,"","",NA,NA,NA,NA,NA,"",NA,".",NA,"","“High-ranking Municipal Police Officer Slain by Gunmen in Monterrey,” Madrid EFE Television, March 23, 2007.","","","CETIS",-9,-9,0,-9,""
"213",2.00704e+11,2007,4,25,"",0,"",217,"United States",1,"North America","Texas","Austin",30.267605,-97.742984,1,0,"","04/25/2007: A time-bomb was found and defused in the parking lot of the Austin Women's Health Center, an abortion clinic, in Austin, Texas, United States. Police arrested one suspect, Paul Ross Evans who is believed to be responsible for the bomb that was hidden in a soft-side insulated cooler. The potassium nitrate bomb contained nails, a 12-inch piece of copper pipe, a mechanical timer and a propane cylinder. It is believed target was selected because it provides reproductive health services.",1,1,1,0,NA,".",0,0,0,3,"Bombing/Explosion",NA,".",NA,".",5,"Abortion Related",40,"Clinics","Abortion Clinic","Austin Women's Health Center",217,"United States",NA,".",NA,".","","",NA,".",NA,".",NA,".","","",NA,".","Unaffiliated Individual(s)","","","","",20202,NA,NA,"","It is believed target was selected because it provides reproductive health services.",1,NA,NA,1,1,0,NA,".",NA,NA,".",NA,NA,".",NA,6,"Explosives/Bombs/Dynamite",14,"Time Fuse",NA,".",NA,".",NA,".",NA,".",NA,".",NA,".","The potassium nitrate bomb contained nails, a 12-inch piece of copper pipe, a mechanical timer and a propane cylinder.",0,0,0,0,0,0,0,NA,".",NA,"",0,NA,NA,NA,NA,"","",NA,NA,NA,NA,NA,"",NA,".",NA,"","Tony Plohetski, Claire Osborn and Elizabeth Campbell, “Package Left at Clinic Was a Bomb,” Austin American-Statesman (Texas), April 27, 2007.","""Bomb at Abortion Clinic, Suspect Arrested,” UPI, April 27, 2007.","","CETIS",-9,-9,0,-9,""
"214",2.00705e+11,2007,5,9,"",0,"",217,"United States",1,"North America","Virginia","Virginia Beach",36.848311,-75.979278,1,0,"","5/9/2007: Unknown perpetrators ignited a fire inside the building housing the Planned Parenthood of Southeastern Virginia in Virginia Beach, United States.  There were no casualties, but three Planned Parenthood offices were damaged.",1,1,1,0,NA,".",0,1,0,7,"Facility/Infrastructure Attack",NA,".",NA,".",5,"Abortion Related",40,"Clinics","Planned Parenthood","Planned Parenthood of Southeastern Virginia",217,"United States",NA,".",NA,".","","",NA,".",NA,".",NA,".","","",NA,".","Anti-Abortion Activists","","","","",1470,NA,NA,"","To protest the practice of abortion and to sabotage abortion facilities operating in North Carolina.",0,NA,NA,-99,-99,0,NA,".",NA,NA,".",NA,NA,".",NA,8,"Incendiary",18,"Arson/Fire",NA,".",NA,".",NA,".",NA,".",NA,".",NA,".","",0,0,0,0,0,0,1,3,"Minor (likely < $1 million)",NA,"One suite of the Planned Parenthood clinic was damaged and two other Planned Parenthood suites sustained smoke damage.",0,NA,NA,NA,NA,"","",0,NA,NA,NA,NA,"",NA,".",NA,"The fire was first reported at 5:40 AM.  The blaze was extinguished quickly by firefighters.","Jon Frank, ""Task Force Says Fire at Center Was Intentional; Planned Parenthood Suites Were Damaged,"" The Virginia Pilot & The Ledger-Star, May 10, 2007.","""Local News Briefs - James City/Hampton/York/Virginia Beach,"" Daily News, May 10, 2007.","Clinic Defense and Research, ""1997 Chronicle of Clinic Harassment & Violence,"" Planned Parenthood Federation of America, Inc.","Anti-Abortion Project 2010",-9,-9,0,-9,""
"215",2.00706e+11,2007,6,24,"",0,"",217,"United States",1,"North America","California","Los Angeles",34.072557,-118.433845,1,0,"outside 465 Loring Ave., the residence of UCLA researcher","06/24/2007: An incendiary device and flammable liquids were planted next to the BMW vehicle of UCLA professor, Arthur Rosenbaum, outside of his residence at 465 Loring Avenue in Los Angeles, California in the United States. The device was lit, but because of a malfunctioned fuse, it did not ignite. Thus, there were no injuries, nor damage.  In a communiqué issued to the North American Animal Liberation Press Office, the Animal Liberation Brigade claimed responsibility for the attempted firebombing, stating that Rosenbaum, who had been regularly harassed by animal-rights activists for his research work with cats and monkeys, should watch his back or he would face injections into his eyes like the primates. Though the L.A. field office for the U.S. Department of Justice ATF Bureau put out a $110,000 reward for information on the perpetrators, no individual perpetrators were identified from the anonymous claim.",1,1,1,0,NA,".",0,0,0,7,"Facility/Infrastructure Attack",NA,".",NA,".",8,"Educational Institution",48,"Teacher/Professor/Instructor","UCLA Professor","UCLA Professor, Arthur Rosenbaum's personal vehicle",217,"United States",NA,".",NA,".","","",NA,".",NA,".",NA,".","","",NA,".","Revolutionary Cells-Animal Liberation Brigade","","","","",20387,NA,NA,"","The group was against research and experiments conducted on animals.",0,NA,NA,-99,-99,1,1,"Letter",NA,NA,".",NA,NA,".",NA,8,"Incendiary",20,"Gasoline or Alcohol",NA,".",NA,".",NA,".",NA,".",NA,".",NA,".","incendiary device w/ fuse and 1 gallon of fuel",0,0,0,0,0,0,0,NA,".",NA,"",0,NA,NA,NA,NA,"","",0,NA,NA,NA,NA,"",NA,".",NA,"The professor had been a target of harassment in the past by animal rights activists through phone calls, emails and intimidating threats screamed over bullhorns.","""Attempted Firebombing of UCLA Researcher's Car Investigated as Terrorism,"" City News Service, June 28, 2007.","Patrick Range McDonald, ""Monkey Madness at Ucla; Violent radicals aim to kill Jules Stein Eye Institute researchers who test on animals,"" LA Weekly (California), August 9, 2007.","""Reward Offered for Information Leading to Arrest of Those Responsible For Attempted Terrorist Attack at Home of University of California: Los Angeles Professor,"" US Fed News, July 24, 2007.","Eco Project 2010",0,0,0,0,""
"216",2.00707e+11,2007,7,10,"",0,"",130,"Mexico",1,"North America","Queretaro (State)","Unknown",20.608914,-100.078262,4,0,"Natural gas pipelines","07/10/2007: Mexican rebel group, People’s Revolutionary Army, claimed responsibility for attacking key Mexican natural gas pipelines in Queretaro State.  Natural gas was cut off to four other Mexican states in the attack.",1,1,1,0,NA,".",0,1,0,3,"Bombing/Explosion",NA,".",NA,".",21,"Utilities",108,"Oil","Petroleos Mexicanos","two pipelines in Queretaro state",130,"Mexico",NA,".",NA,".","","",NA,".",NA,".",NA,".","","",NA,".","Popular Revolutionary Army (Mexico)","","","","",940,NA,NA,"","Unknown",0,NA,NA,NA,0,1,10,"Unknown",NA,NA,".",NA,NA,".",-9,6,"Explosives/Bombs/Dynamite",16,"Unknown Explosive Type",NA,".",NA,".",NA,".",NA,".",NA,".",NA,".","",0,0,0,0,0,0,1,2,"Major (likely > $1 million but < $1 billion)",6400000,"",0,NA,NA,NA,NA,"","",NA,NA,NA,NA,NA,"",NA,".",NA,"","Marion Lloyd, “Rebel blasts in Mexico idle hundreds of firms; At least 4 states lose natural gas source in attacks on key pipelines, The Houston Chronicle, July 12, 2007.","2. “Mexico's Gas Attacks,” Investor's Business Daily, July 12, 2007.","“Attacks on natural gas pipeline disrupt Mexico's businesses,” Monterey County Herald (California), July 12, 2007.","CETIS",0,0,0,0,""
"217",2.00707e+11,2007,7,14,"",0,"",130,"Mexico",1,"North America","Nuevo Leon (State)","Guadalupe",25.684139,-100.250999,1,0,"In the police chief's SUV","07/14/2007: Candelario Juarez, police chief of Guadalupe in the Mexican state of Nuevo Leon, survived an attack on his convoy by armed gunmen in Guadalupe, Monterrey, Mexico. One of his bodyguards was killed and three other bodyguards were wounded. It is unsure what the motive behind the assassination attempt.",1,1,1,0,NA,".",0,1,0,1,"Assassination",NA,".",NA,".",3,"Police",25,"Police Security Forces/Officers","Mexican Police","Candelario Juarez, police chief of Guadalupe",130,"Mexico",NA,".",NA,".","","",NA,".",NA,".",NA,".","","",NA,".","Unknown","","","","",-9,NA,NA,"","Unknown",0,NA,NA,NA,0,0,NA,".",NA,NA,".",NA,NA,".",NA,5,"Firearms",2,"Automatic Weapon",NA,".",NA,".",NA,".",NA,".",NA,".",NA,".","",1,0,0,3,0,0,0,NA,".",NA,"",0,NA,NA,NA,NA,"","",NA,NA,NA,NA,NA,"",NA,".",NA,"","“Police Chief of City in Northern Mexico Survives Second Assassination Attempt,” Madrid EFE, July 15, 2007.","","","CETIS",-9,-9,0,-9,""
"218",2.00708e+11,2007,8,27,"",0,"",130,"Mexico",1,"North America","Aguascalientes","Aguascalientes",21.881796,-102.29127,1,0,"","08/27/2007: Four police officers were gunned down and killed in two separate attacks in Aguascalientes City, Mexico. The perpetrator(s) were unidentified and there were no media accounts of any group claiming responsibility for the attack.",1,1,1,0,NA,".",0,1,0,2,"Armed Assault",NA,".",NA,".",3,"Police",25,"Police Security Forces/Officers","Mexico Police","deputy police chief Cristo Claudio Pascual and officer Jesus Badillo, and Maj. Ramon Esparza",130,"Mexico",NA,".",NA,".","","",NA,".",NA,".",NA,".","","",NA,".","Unknown","","","","",-9,NA,NA,"","Unknown",0,NA,NA,NA,7,0,NA,".",NA,NA,".",NA,NA,".",NA,5,"Firearms",5,"Unknown Gun Type",NA,".",NA,".",NA,".",NA,".",NA,".",NA,".","",4,0,0,2,0,0,0,NA,".",NA,"",0,NA,NA,NA,NA,"","",NA,NA,NA,NA,NA,"",NA,".",NA,"","“Mexico: Gunmen Kill 4 Police Officers in 2 Separate Instance in Aguascalientes” EFE.  August 27, 2007.","","","CETIS",-9,-9,0,-9,""
"219",2.00709e+11,2007,9,10,"",0,"",130,"Mexico",1,"North America","Veracruz (State) and Tlaxcala (State)","Veracruz (State) and Tlaxcala (State)",NA,NA,5,0,"","09/10/2007: Under the cover of night, operatives from the Popular Revolutionary Army sabotaged various oil and gas pipelines throughout the Mexican states of Veracruz and Tlaxcala. Although no one was killed or injured in the early morning sabotage, about 12,000 people were temporarily evacuated due to the raging fires at the four separate blast sites.",1,1,1,0,NA,".",0,1,0,7,"Facility/Infrastructure Attack",NA,".",NA,".",21,"Utilities",107,"Electricity","Energy pipelines","Oil and gas pipelines",130,"Mexico",NA,".",NA,".","","",NA,".",NA,".",NA,".","","",NA,".","Other","","","","",20348,NA,NA,"","To disrupt energy flow throughout the country",0,NA,NA,NA,0,1,7,"Posted to website, blog, etc.",NA,NA,".",NA,NA,".",-9,11,"Sabotage Equipment",NA,".",6,"Explosives/Bombs/Dynamite",16,"Unknown Explosive Type",NA,".",NA,".",NA,".",NA,".","",0,0,0,0,0,0,1,2,"Major (likely > $1 million but < $1 billion)",NA,"",0,NA,NA,NA,NA,"","",NA,NA,NA,NA,NA,"",NA,".",NA,"The Popular Revolutionary Army demanded that their comrades in jail were to be free.","Laurence Iliff, ""6 Mexican oil pipeline blasts linked to leftist group,"" The Dallas Morning News (Texas), September 11, 2007.","Michael O'Boyle, ""Pipeline Bombings Hit Mexico Industry Peso Shrugs Off Attacks,"" The Main Wire, September 11, 2007.","James C. McKinley Jr., ""Rebels Blow Up Pipelines in Mexico, Disrupting Service,"" The New York Times, September 11, 2007.","CETIS",-9,-9,0,-9,""
"220",2.0071e+11,2007,10,20,"",0,"",217,"United States",1,"North America","California","Los Angeles",34.05349,-118.245319,1,0,"The home of Professor London in Beverly Hills neighborhood.","10/20/2007: No casualties were reported but a house was damaged when an unknown number of Animal Liberation Front (ALF) perpetrators broke a window and diverted a garden hose to flood the home of University of California, Los Angeles (UCLA) Professor Edythe London in Beverly Hills neighborhood, Los Angeles, California, United States.",1,1,1,0,NA,".",0,1,0,7,"Facility/Infrastructure Attack",NA,".",NA,".",8,"Educational Institution",48,"Teacher/Professor/Instructor","UCLA Professor","Edythe London",217,"United States",NA,".",NA,".","","",NA,".",NA,".",NA,".","","",NA,".","Animal Liberation Front (ALF)","","","","",291,NA,NA,"","To stop the victim from experimenting on animals with nicotine and narcotics.",0,NA,NA,NA,0,1,7,"Posted to website, blog, etc.",NA,NA,".",NA,NA,".",0,11,"Sabotage Equipment",NA,".",NA,".",NA,".",NA,".",NA,".",NA,".",NA,".","",0,0,0,0,0,0,1,3,"Minor (likely < $1 million)",30000,"The professor's house suffered between $20 and $40 thousand dollars in damages.",0,NA,NA,NA,NA,"","",NA,NA,NA,NA,NA,"",NA,".",NA,"The flooding caused between $20,000 and $40,000 in damage and  ALF claimed responsibility in a post-incident post to an animal liberation website. The group accused London of addicting animals to nicotine and narcotics for research purposes.","“Animal liberation group claims responsibility for house flooding,” Associated Press State & Local Wire, October 30, 2007.","Edward Truong, “Activists flood UCLA professor’s home,” University Wire, October 30, 2007.","“House flooded over monkey research,” United Press International, October 30, 2007.","CETIS",0,1,0,1,""
"221",2.0071e+11,2007,10,26,"",0,"",217,"United States",1,"North America","New York","New York City",40.712784,-74.005941,1,0,"At the Mexican Consulate at 27 East 39th Street.","10/26/2007: No casualties were reported but three windows were damaged when a single unknown perpetrator on a bicycle threw two hand grenades (replicas filled with explosive powder) at the Mexican Consulate at 27 East 39th Street in New York City, New York, United States at approximately 3:40 AM. There were no media accounts of any group claiming responsibility for the attack.",1,1,1,0,NA,".",0,1,0,3,"Bombing/Explosion",NA,".",NA,".",7,"Government (Diplomatic)",46,"Embassy/Consulate","Mexican Consulate","Mexican Consulate in New York.",130,"Mexico",NA,".",NA,".","","",NA,".",NA,".",NA,".","","",NA,".","Unaffiliated Individual(s)","","","","",20202,NA,NA,"","Retaliation for the death of New York journalist Bradley Roland Will, killed one year before in Mexico while covering paramilitary activity in Mexico",0,NA,NA,NA,0,0,NA,".",NA,NA,".",NA,NA,".",NA,6,"Explosives/Bombs/Dynamite",7,"Grenade",NA,".",NA,".",NA,".",NA,".",NA,".",NA,".","",0,0,0,0,0,0,1,3,"Minor (likely < $1 million)",NA,"Three windows were damaged.",0,NA,NA,NA,NA,"","",NA,NA,NA,NA,NA,"",NA,".",NA,"One of the grenades was a World War Two-style striated ‘pineapple’ design and the other was a Vietnam War-style smooth ‘lemon’ design. An attack with matching modus operandi occurred at the British Consulate in New York City on May 5, 2005. Police suggested the attack may have come in retaliation for the death of New York journalist Bradley Roland Will, who was shot and killed one year before while videotaping a standoff between demonstrators and unknown armed individuals (possibly Mexican paramilitaries) in Oaxaca, Mexico.","Tom Hays, “Explosives break window at Mexican Consulate in NYC,” Associated Press Worldstream, October 26, 2007.","Al Baker, “2 crude bombs hit Mexican Consulate, in echo of 2005 attack,” New York Times, October 27, 2007.","“Device explodes near Mexican consulate,” United Press International, October 26, 2007.","CETIS",-9,-9,1,1,""
