"16",200303280008,2003,3,28,"",0,"",144,"New Zealand",12,"Australasia & Oceania","Wellington (Region)","Wellington",-41.28646,174.776236,1,0,"","03/28/2003:  A group calling itself the September 11 group claimed responsibility for contaminating beverage supplies with cyanide in Wellington, New Zealand.  No injuries were reported in the incident.",1,1,1,0,NA,".",0,0,0,8,"Unarmed Assault",NA,".",NA,".",14,"Private Citizens & Property",67,"Unnamed Civilian/Unspecified","New Zealand citizens.","Indiscriminate consumers of beverages in Wellington, New Zealand.",144,"New Zealand",NA,".",NA,".","","",NA,".",NA,".",NA,".","","",NA,".","September 11","","","","",20408,NA,NA,"","To protest the U.S. led invasion of Iraq.",0,NA,NA,NA,0,1,3,"Call (pre-incident)",NA,NA,".",NA,NA,".",-9,2,"Chemical",NA,".",NA,".",NA,".",NA,".",NA,".",NA,".",NA,".","Cyanide",0,0,0,0,0,0,0,NA,".",NA,"",0,NA,NA,NA,NA,"","",0,NA,NA,NA,NA,"",NA,".",NA,"","“New Cyanide Letter Heightens New Zealand Terror Threats,” Associated Press Worldstream, March 28, 2003.","“Food Warning as New Cyanide Letters Sent to the Herald,” The New Zealand Herald, March 29, 2003.","“Further Cyanide Letters Arrive,” The Christchurch Press, March 29, 2003.","CETIS",0,0,0,0,""
"17",200604080012,2006,4,8,"",0,"",14,"Australia",12,"Australasia & Oceania","Queensland (State)","Broadbeach",-28.0291,153.431388,1,0,"","04/08/2006: The mobile phone shop of former Shapelle Corby backer Ron Bakir was firebombed at 6:00 a.m. when a man bashed the glass doors of the shop with a rock before dropping a cigarette into a canister of fuel on the footpath outside in Broadbeach, Australia. No group claimed responsibility for the attack.",1,1,1,1,2,"Other Crime Type",0,1,0,3,"Bombing/Explosion",NA,".",NA,".",1,"Business",7,"Retail/Grocery/Bakery","Business of Broadbeach","Mobile phone shop of Ron Bakir in Broadbeach",14,"Australia",NA,".",NA,".","","",NA,".",NA,".",NA,".","","",NA,".","Unaffiliated Individual(s)","","","","",20202,NA,NA,"","Unknown",0,NA,NA,1,0,0,NA,".",NA,NA,".",NA,NA,".",NA,8,"Incendiary",20,"Gasoline or Alcohol",NA,".",NA,".",NA,".",NA,".",NA,".",NA,".","The fire was caused by a plastic container of fuel and lit with a cigarette.",0,0,0,0,0,0,1,4,"Unknown",NA,"The fire damaged the door but was put out before the container exploded.",0,NA,NA,NA,NA,"","",NA,NA,NA,NA,NA,"",NA,".",NA,"No one was in the store at the time. Ron Bakir could not suggest a potential reason for this attack. He had previously praised people of the Gold Coast for ignoring calls to join race riots.","Weston, Paul, “Firebomb raid on Corby's ex-backer,” The Sunday Mail (Australia), April 09, 2006.","“Quick News,” Sunday Tasmanian (Australia), April 09, 2006.","“Attack mystifies Bakir,” Northern Territory News (Australia), April 09, 2006.","CETIS",-9,-9,0,-9,""
"18",200608010001,2006,8,1,"",0,"",14,"Australia",12,"Australasia & Oceania","New South Wales (State)","Paramatta",-33.815128,151.003155,1,0,"","08/01/2006: A group of Middle Eastern men stoned Sydney, Australia’s Parramatta Synagogue’s roof and windows and damaged cars nearby. No group has claimed responsiblity for this attack.",1,1,1,0,NA,".",0,1,0,7,"Facility/Infrastructure Attack",NA,".",NA,".",15,"Religious Figures/Institutions",86,"Place of Worship","Synagogue","Parramatta Synagogue",14,"Australia",NA,".",NA,".","","",NA,".",NA,".",NA,".","","",NA,".","Unknown","","","","",-9,NA,NA,"","Unknown",0,NA,NA,10,NA,0,NA,".",NA,NA,".",NA,NA,".",NA,12,"Other",21,"Blunt Object",NA,".",NA,".",NA,".",NA,".",NA,".",NA,".","",0,0,0,NA,0,0,-9,NA,".",NA,"",0,NA,NA,NA,NA,"","",NA,NA,NA,NA,NA,"",NA,".",NA,"","Russell Skelton and Sarah Smiles, “Sydney synagogue rocked by attack,” The Age, August 1, 2006.","“Synagogue is war victim,” The Daily Telegraph, August 1, 2006.","","CETIS",-9,-9,0,-9,""
"19",200711090014,2007,11,9,"",0,"",157,"Papua New Guinea",12,"Australasia & Oceania","South Highlands (Province)","Nipa",-6.127153,143.420306,1,0,"","11/09/2007: Tribesmen with firearms attacked a police squad in Nipa, Papua New Guinea, taking six officers hostage. After holding the officers for an hour, the tribesmen took the officers' weapons and released them.",1,1,1,0,NA,".",0,1,0,5,"Hostage Taking (Barricade Incident)",NA,".",NA,".",3,"Police",25,"Police Security Forces/Officers","Nipa Police Forces","Police Officers",157,"Papua New Guinea",NA,".",NA,".","","",NA,".",NA,".",NA,".","","",NA,".","Unknown","","","","",-9,NA,NA,"","Unknown",0,NA,NA,NA,0,0,NA,".",NA,NA,".",NA,NA,".",NA,5,"Firearms",5,"Unknown Gun Type",NA,".",NA,".",NA,".",NA,".",NA,".",NA,".","",0,0,0,NA,0,0,-9,NA,".",NA,"",1,6,0,1,NA,"","",0,NA,NA,NA,NA,"",2,"Hostage(s) released by perpetrators",6,"The hostages were released but the tribesmen took their weapons.","Andrew Alphonse, ""Papua New Guinea tribesmen steal police guns in hostage incident,"" The National, November 12, 2007.","""PNG: Police in Firefight with Tribesmen at Nipa, Southern Highlands Province,"" The National, November 13, 2007.","","CETIS",-9,-9,0,-9,""
"20",200804150015,2008,4,15,"",0,"",144,"New Zealand",12,"Australasia & Oceania","Wellington","Wellington",-41.28646,174.776236,1,0,"The attack took place in Wellington.","04/15/2008: On Tuesday morning, on Conventry Road, in Hastings, New Zealand, six pipe bombs were found and dismantled by the Army's bomb disposal units at Cash for Scrap. No casualties or damage resulted from the attempted attack. No motive was reported and no group claimed responsibility.",1,1,1,0,NA,".",0,0,0,3,"Bombing/Explosion",NA,".",NA,".",1,"Business",5,"Industrial/Textiles/Factory","Cash for Scrap","A scrap yard",144,"New Zealand",NA,".",NA,".","","",NA,".",NA,".",NA,".","","",NA,".","Unknown","","","","",-9,NA,NA,"","The specific motive for the attack is unknown.",0,NA,NA,-99,0,0,NA,".",NA,NA,".",NA,NA,".",NA,6,"Explosives/Bombs/Dynamite",17,"Other Explosive Type",NA,".",NA,".",NA,".",NA,".",NA,".",NA,".","Pipe bombs were used in the attack.",0,0,0,0,0,0,0,NA,".",NA,"",0,NA,NA,NA,NA,"","",NA,NA,NA,NA,NA,"",NA,".",NA,"","Reuters, ""Suspected Pipe Bombs Found in New Zealand City: Report,"" Reuters, April 15, 2008.","","","ISVG",-9,-9,0,-9,""
"21",200804210001,2008,4,21,"",0,"",14,"Australia",12,"Australasia & Oceania","Queensland","Vale View",-27.661735,151.897583,1,0,"The attempted bombing took place in Federation Park on the Drayton Connection Road, near Vale View south of Toowoomba, Queensland, Australia.","04/21/2008: On Monday, a 30 mm pipe bomb rigged with external batteries and a mobile phone was detonated by the police bomb squad unit after it was found by council workers in Federation Park on the Drayton Connection Road, near Vale View south of Toowoomba, Queensland, Australia. No claim of responsibility was made for the attempted bombing, however on 04/22/2008 on Tuesday, executed a search warrant at a home in Kent Street at Oakey and allegedly found evidence of a home-made explosive device. A 21-year-old man was arrested and charged with one count of attempting to damage property by explosives.",1,1,1,0,NA,".",0,0,0,3,"Bombing/Explosion",NA,".",NA,".",14,"Private Citizens & Property",79,"Public Area (garden, parking lot, garage, beach, public building, camp)","","Federation Park",14,"Australia",NA,".",NA,".","","",NA,".",NA,".",NA,".","","",NA,".","Unknown","","","","",-9,NA,NA,"","The specific motive for the attack is unknown or was not reported.",0,NA,NA,1,1,0,NA,".",NA,NA,".",NA,NA,".",NA,6,"Explosives/Bombs/Dynamite",12,"Remote Trigger",NA,".",NA,".",NA,".",NA,".",NA,".",NA,".","A mobile phone-triggered, battery-powered, 30 mm pipe was used in the attack.",0,0,0,0,0,0,0,NA,".",NA,"",0,NA,NA,NA,NA,"","",NA,NA,NA,NA,NA,"",NA,".",NA,"","News.com.au, ""Police Destroy Pipe Bomb Found at Toowoomba Park,"" http://news.com.au (accessed April 22, 2008).","AAP Newsfeed, ""Qld: Man Charged Over Pipe Bomb Found in Park,"" Lexis Nexis, AAP Newsfeed, April 23, 2008.","","ISVG",-9,-9,0,-9,""
"22",200806240014,2008,6,24,"",0,"",144,"New Zealand",12,"Australasia & Oceania","Wellington","Wellington",-41.28646,174.776236,1,0,"The chemical attack took place at the Ministry of Agriculture building in Wellington, Wellington State, New Zealand.","6/24/2008: On Tuesday, a letter containing 1080 poison was sent to the Ministry of Agriculture and Forestry building in Wellington, Wellington State, New Zealand. The 1080 poison is used as a pesticide. No casualties were reported and no claim of responsibility was made for the incident.",1,1,1,0,NA,".",1,0,0,8,"Unarmed Assault",NA,".",NA,".",2,"Government (General)",21,"Government Building/Facility/Office","New Zealander Government","The New Zealander Ministry of Agriculture and Forestry building",144,"New Zealand",NA,".",NA,".","","",NA,".",NA,".",NA,".","","",NA,".","Unknown","","","","",-9,NA,NA,"","The specific motive for the attack is unknown.",0,NA,NA,-99,0,0,NA,".",NA,NA,".",NA,NA,".",NA,2,"Chemical",1,"Poisoning",NA,".",NA,".",NA,".",NA,".",NA,".",NA,".","1080 poison was used in the chemical attack.",0,0,0,0,0,0,0,NA,".",NA,"",0,NA,NA,NA,NA,"","",NA,NA,NA,NA,NA,"",NA,".",NA,"","New Zealand Herald, ""Government Departments Targeted with 1080 Poison,"" New Zealand Herald, June 25, 2008.","New Zealand Press Association, ""Police Investigate Three Packages Of 1080 Sent To Government,"" Lexis Nexis, New Zealand Press Association, June 25, 2008.","Dominion Post, ""Suspicious Packages May Contain 1080,"" Lexis Nexis, Dominion Post, June 26, 2008.","ISVG",-9,-9,0,-9,"200806240016, 200806240017"
"23",200806240016,2008,6,24,"",0,"",144,"New Zealand",12,"Australasia & Oceania","Wellington","Wellington",-41.28646,174.776236,1,0,"The chemical attack took place at the Parliament building in Wellington, Wellington State, New Zealand.","6/24/2008: On Tuesday, a letter containing 1080 poison was sent to the Parliament building in Wellington, Wellington State, New Zealand. The 1080 poison is used as a pesticide. No casualties were reported and no claim of responsibility was made for the incident.",1,1,1,0,NA,".",1,0,0,8,"Unarmed Assault",NA,".",NA,".",2,"Government (General)",21,"Government Building/Facility/Office","New Zealander Government","The New Zealander Parliament building",144,"New Zealand",NA,".",NA,".","","",NA,".",NA,".",NA,".","","",NA,".","Unknown","","","","",-9,NA,NA,"","The specific motive for the attack is unknown.",0,NA,NA,-99,0,0,NA,".",NA,NA,".",NA,NA,".",NA,2,"Chemical",1,"Poisoning",NA,".",NA,".",NA,".",NA,".",NA,".",NA,".","1080 poison was used in the chemical attack.",0,0,0,0,0,0,0,NA,".",NA,"",0,NA,NA,NA,NA,"","",NA,NA,NA,NA,NA,"",NA,".",NA,"","New Zealand Herald, ""Government Departments Targeted with 1080 Poison,"" New Zealand Herald, June 25, 2008.","","","ISVG",-9,-9,0,-9,"200806240014, 200806240017"
"24",200806240017,2008,6,24,"",0,"",144,"New Zealand",12,"Australasia & Oceania","Wellington","Wellington",-41.28646,174.776236,1,0,"The chemical attack took place at the Government Reserve Bank in Wellington, Wellington State, New Zealand.","6/24/2008: On Tuesday, a letter containing 1080 poison was sent to the Government Reserve Bank in Wellington, Wellington State, New Zealand. The 1080 poison is used as a pesticide. No casualties were reported and no claim of responsibility was made for the incident.",1,1,1,0,NA,".",1,0,0,8,"Unarmed Assault",NA,".",NA,".",2,"Government (General)",21,"Government Building/Facility/Office","New Zealander Government","The New Zealander Government Reserve Bank,",144,"New Zealand",NA,".",NA,".","","",NA,".",NA,".",NA,".","","",NA,".","Unknown","","","","",-9,NA,NA,"","The specific motive for the attack is unknown.",0,NA,NA,-99,0,0,NA,".",NA,NA,".",NA,NA,".",NA,2,"Chemical",1,"Poisoning",NA,".",NA,".",NA,".",NA,".",NA,".",NA,".","1080 poison was used in the chemical attack.",0,0,0,0,0,0,0,NA,".",NA,"",0,NA,NA,NA,NA,"","",NA,NA,NA,NA,NA,"",NA,".",NA,"","New Zealand Herald, ""Government Departments Targeted with 1080 Poison,"" New Zealand Herald, June 25, 2008.","","","ISVG",-9,-9,0,-9,"200806240014, 200806240016"
"25",200808130025,2008,8,13,"",0,"",144,"New Zealand",12,"Australasia & Oceania","Wellington","Wellington",-41.28646,174.776236,1,0,"The envelope was sent to the party offices of the Prime Minister Helen Clark in Wellington, New Zealand.","08/13/2008: On Wednesday, a white powder was found in an envelope in the party offices of the Prime Minister Helen Clark in Wellington, New Zealand. The area was evacuated and decontaminated though the nature of the powder has not been confirmed. Douglas Hancock pleaded guilty to sending the letter.",1,1,1,0,NA,".",0,0,0,8,"Unarmed Assault",NA,".",NA,".",2,"Government (General)",17,"Head of State","New Zealand Government","Prime Minister Helen Clark",144,"New Zealand",NA,".",NA,".","","",NA,".",NA,".",NA,".","","",NA,".","Unknown","","","","",-9,NA,NA,"","The specific motive for the attack is unknown.",0,NA,NA,1,1,0,NA,".",NA,NA,".",NA,NA,".",NA,2,"Chemical",1,"Poisoning",NA,".",NA,".",NA,".",NA,".",NA,".",NA,".","An unknown white powder was used in the attack.",0,0,0,0,0,0,0,NA,".",NA,"",0,NA,NA,NA,NA,"","",NA,NA,NA,NA,NA,"",NA,".",NA,"","Sanjeev Miglani, ""New Zealand PM's Office Evacuated After Powder Scare,"" Reuters, August 12, 2008.","Triton, ""A White Powder Found in an Envelope in the Party Offices of the Prime Minister in Wellington,"" Triton Reports, September 12, 2008.","New Zealand Herald, ""Farmer Admits Sending White Powder to PM,"" New Zealand Herald, September 17, 2008.","ISVG",-9,-9,0,-9,""
"26",200812080008,2008,12,8,"",0,"",14,"Australia",12,"Australasia & Oceania","Western Australia","Joondalup",-31.743357,115.764172,1,0,"Joondalup Police Station","12/08/2008: On Monday, a Holden Rodeo ute vehicle carrying a 220-liter fuel tank was backed into the Joondalup police station and set aflame. The attack damaged two offices, one of which was the inspector's District Office. No casualties were reported.",1,1,1,0,NA,".",0,1,0,7,"Facility/Infrastructure Attack",NA,".",NA,".",3,"Police",22,"Police Building (headquarters, station, school)","","Joondalup Police station",14,"Australia",NA,".",NA,".","","",NA,".",NA,".",NA,".","","",NA,".","Unknown","","","","",-9,NA,NA,"","The specific motive for the attack is unknown.",0,NA,NA,1,0,0,NA,".",NA,NA,".",NA,NA,".",NA,8,"Incendiary",20,"Gasoline or Alcohol",NA,".",NA,".",NA,".",NA,".",NA,".",NA,".","A fuel tank was set ablaze in the attack.",0,0,0,0,0,0,1,4,"Unknown",NA,"The attack caused an unknown amount of property damage.",0,NA,NA,NA,NA,"","",-9,NA,NA,NA,NA,"",NA,".",NA,"","ABC, ""Police Seeking Man Over Firebombings,"" http://www.abc.net.au/news/stories/2008/12/10/2442883.htm"" (December 10, 2008).","PerthNow, Cox, Nicole, ""Attack on Warwick Police Station Follows Joondalup Firebombing,"" http://www.news.com.au/perthnow/story/0,21598,24778930-2761,00.html (December 10, 2008).","PerthNow, Stanley, Warwick, ""Joondalup Police tation Damaged by Fire Attack,"" http://www.news.com.au/perthnow/story/0,21598,24772985-2761,00.html (December 09, 2009).","ISVG",-9,-9,0,-9,""
"27",200812100007,2008,12,10,"",0,"",14,"Australia",12,"Australasia & Oceania","Western Australia","Joondalup",-31.743357,115.764172,1,0,"Warwick district, Joondalup Warwick Police station","12/10/2008: On Wednesday morning, at 0235, two private vehicles belonging to Warwick police officers were firebombed in Joondalup, Western Australia, Oceania, Australia.",1,1,1,0,NA,".",0,1,0,7,"Facility/Infrastructure Attack",NA,".",NA,".",3,"Police",25,"Police Security Forces/Officers","","The target were private vehicles of police officers in Warwick",14,"Australia",NA,".",NA,".","","",NA,".",NA,".",NA,".","","",NA,".","Unknown","","","","",-9,NA,NA,"","The specific motive for the attack is unknown.",0,NA,NA,-99,0,0,NA,".",NA,NA,".",NA,NA,".",NA,8,"Incendiary",19,"Molotov Cocktail/Petrol Bomb",NA,".",NA,".",NA,".",NA,".",NA,".",NA,".","A firebomb was used in the attack",0,0,0,0,0,0,1,4,"Unknown",60000,"Two private vehicles of Warwick police officers were firebounded.",0,NA,NA,NA,NA,"","",-9,NA,NA,NA,NA,"",NA,".",NA,"","Watoday, Thomson, Chris, and Chalpat Sonti, ""Man Charged Over Joondalup Police Station Bombing,"" http://www.watoday.com.au/wa-news/man-charged-over-joondalup-police-station-bombing-20081210-6v6v.html?page=-1 (December 10, 2008).","ABC Premium News, ""Second Warwick Police Station Firebombed,"" LexisNexis Academic, ABC Premium News, December 10, 2008.","","ISVG",-9,-9,0,-9,""
"28",200910080019,2009,10,8,"",0,"",14,"Australia",12,"Australasia & Oceania","New South Wales","Condell Park",-33.922832,151.011897,1,0,"The explosive was placed on the hood of a car on Market Street at Condell Park, Sydney, New South Wales, Australia.","10/08/2009: On Thursday night at 0100, in Market Street in Condell park, Sydney, New South Wales, Australia, an improvised explosive device placed on the hood of a car detonated, smashing the windows of two townhouses and destroying the vehicle. Investigator Mark Smith says it is not clear if the device was intended for the vehicle or the townhouses 10-15 meters away. No group claimed responsibility.",1,1,1,0,NA,".",0,1,0,3,"Bombing/Explosion",NA,".",NA,".",14,"Private Citizens & Property",73,"Vehicles/Transportation","","A civilian vehicle was targeted in the attack.",14,"Australia",NA,".",NA,".","","",NA,".",NA,".",NA,".","","",NA,".","Unknown","","","","",-9,NA,NA,"","The specific motive for the attack is unknown.",0,NA,NA,-99,0,0,NA,".",NA,NA,".",NA,NA,".",NA,6,"Explosives/Bombs/Dynamite",29,"Sticky Bomb",NA,".",NA,".",NA,".",NA,".",NA,".",NA,".","An improvised explosive device placed  on the hood of a car was used in the attack.",0,0,0,0,0,0,1,4,"Unknown",NA,"Civilian townhouses were damaged and a vehicle was destroyed.",0,NA,NA,NA,NA,"","",NA,NA,NA,NA,NA,"",NA,".",NA,"","Abc. Net,""Car, Houses Damaged by Homemade Bomb,"" http://www.abc.net.au/news/stories/2009/10/08/2707922.htm?section=australia(October 8, 2009).","Australian Associated Press,""Highlights of the AAP National Wire at 14:30, October Eight,"" LexisNexis Academic, Australian Associated Press, October 8, 2009","","ISVG",-9,-9,0,-9,""
"29",201002040023,2010,2,4,"",0,"",14,"Australia",12,"Australasia & Oceania","Western Australia","Perth",-31.952854,115.857339,1,0,"The attack took place at a mosque in Queens Park, Perth.","02/04/2010: On Thursday night, in Queens Park, Perth, Western Australia, Australia, armed assailants fired upon a mosque, damaging the mosque but causing no casualties. No group claimed responsibility, although authorities believed Combat 18 was responsible.",1,1,1,0,NA,".",0,1,0,2,"Armed Assault",NA,".",NA,".",15,"Religious Figures/Institutions",86,"Place of Worship","","The target was a mosque.",14,"Australia",NA,".",NA,".","","",NA,".",NA,".",NA,".","","",NA,".","Combat 18","","","","",20130,NA,NA,"","The specific motive for the attack is unknown.",1,NA,NA,-99,0,0,NA,".",NA,NA,".",NA,NA,".",NA,5,"Firearms",5,"Unknown Gun Type",NA,".",NA,".",NA,".",NA,".",NA,".",NA,".","Unknown firearms were used in the attack.",0,0,0,0,0,0,1,3,"Minor (likely < $1 million)",NA,"A mosque was damaged in the attack.",0,NA,NA,NA,NA,"","",NA,NA,NA,NA,NA,"",NA,".",NA,"","National Counterterrorism Center, ""One Mosque Damaged in Armed Attack by Suspected Combat 18 in Perth, Western Australia, Australia,"" Worldwide Incidents Tracking System, July 9, 2010.","ABC Premium News, ""Shots Fired at Mosque,"" LexisNexis Academic, ABC News, February 10, 2010.","West Australian, ""Police Probe Mosque Attack,"" LexisNexis Academic, West Australian, February 11, 2010.","ISVG",1,1,0,1,""
"30",201309020036,2013,9,2,"",0,"",14,"Australia",12,"Australasia & Oceania","Victoria","Melbourne",-37.808896,144.950421,1,0,"The incident occurred in the West Melbourne area of the city.","09/02/2013: Assailants set fire to Gran Turismo Autos, a luxury car showroom, in West Melbourne area, Melbourne city, Victoria state, Australia. The fire damaged several vehicles, but did not cause any casualties. The Felicity Ann Ryder Cell of the Informal Anarchist Federation claimed responsibility for the attack in a post online; however, police denied that the group was involved in the incident.",1,1,1,1,4,"Lack of Intentionality",0,1,0,7,"Facility/Infrastructure Attack",NA,".",NA,".",1,"Business",7,"Retail/Grocery/Bakery","Gran Turismo Autos","Car Dealership",14,"Australia",NA,".",NA,".","","",NA,".",NA,".",NA,".","","",NA,".","Informal Anarchist Federation","Felicity Ann Ryder Cell","","","",20203,NA,NA,"","",0,NA,NA,-99,0,1,7,"Posted to website, blog, etc.",NA,NA,".",NA,NA,".",NA,8,"Incendiary",18,"Arson/Fire",NA,".",NA,".",NA,".",NA,".",NA,".",NA,".","",0,0,0,0,0,0,1,4,"Unknown",-99,"Approximately a dozen luxury vehicles and $150,000 worth of stock at a neighboring apparel business were damaged in this attack.",0,NA,NA,NA,NA,"","",NA,NA,NA,NA,NA,"",NA,".",NA,"There is doubt that this incident meets terrorism-related criteria. Authorities suspected that the fire may have been accidentally started by a lit cigarette.","""Anarchists claim responsibility for fire at luxury West Melbourne car dealership, but police have doubts,"" Herald Sun (Australia), September 3, 2013.","""Signs Of Life In Australia : A Chronology of Recent Anarchist & Anti-Colonial Activity Down Under,"" 325, May 7, 2014.","","START Primary Collection",1,1,0,1,""
"31",201402070065,2014,2,7,"",0,"",144,"New Zealand",12,"Australasia & Oceania","Wellington","Upper Hutt",-41.124433,175.070783,1,0,"","02/07/2014: Assailants set fire to a Kentucky Fried Chicken (KFC) restaurant in Upper Hutt city, Wellington region, New Zealand. There were no injuries in the attack; however, the building was badly damaged by the fire. The Animal Liberation Front (ALF) claimed responsibility for the incident in a post online.",1,1,1,0,NA,".",0,1,0,7,"Facility/Infrastructure Attack",NA,".",NA,".",1,"Business",2,"Restaurant/Bar/Café","KFC","Restaurant",144,"New Zealand",NA,".",NA,".","","",NA,".",NA,".",NA,".","","",NA,".","Animal Liberation Front (ALF)","","","","",291,NA,NA,"","",0,NA,NA,-99,0,1,7,"Posted to website, blog, etc.",NA,NA,".",NA,NA,".",NA,8,"Incendiary",18,"Arson/Fire",NA,".",NA,".",NA,".",NA,".",NA,".",NA,".","",0,0,0,0,0,0,1,3,"Minor (likely < $1 million)",-99,"A Kentucky Fried Chicken restaurant was damaged in this attack.",0,NA,NA,NA,NA,"","",NA,NA,NA,NA,NA,"",NA,".",NA,"","""Upper Hutt KFC damaged in fire,"" Newstalk ZB, February 7, 2014.","""KFC Damaged in Fire,"" Animal Liberation Front.com, February 10, 2014.","","START Primary Collection",0,1,0,1,""
"32",201402240121,2014,2,24,"",0,"",14,"Australia",12,"Australasia & Oceania","Queensland","Logan",-27.639793,153.108516,1,0,"","02/24/2014: Assailants threw three homemade incendiary devices at the Logan Police District Headquarters in Logan City, southeast Queensland state, Australia. There were no casualties in the incident; however, one police vehicle suffered fire damage. No group claimed responsibility for the incident; however, sources attributed the attack to anarchists.",1,1,1,0,NA,".",0,1,0,7,"Facility/Infrastructure Attack",NA,".",NA,".",3,"Police",22,"Police Building (headquarters, station, school)","Australian Federal Police (AFP)","Logan District Headquarters",14,"Australia",NA,".",NA,".","","",NA,".",NA,".",NA,".","","",NA,".","Anarchists","","","","",648,NA,NA,"","The specific motive is unknown; however, sources noted that the attack comes after an incident of police brutality which left an indigenous woman partly blind.",0,NA,NA,-99,0,0,NA,".",NA,NA,".",NA,NA,".",NA,8,"Incendiary",19,"Molotov Cocktail/Petrol Bomb",NA,".",NA,".",NA,".",NA,".",NA,".",NA,".","Three Molotov cocktails were used in the attack.",0,0,0,0,0,0,1,3,"Minor (likely < $1 million)",-99,"A police vehicle was damaged in this attack.",0,NA,NA,NA,NA,"","",NA,NA,NA,NA,NA,"",NA,".",NA,"","""The Logan Police District Headquarters at Logan Central has been attacked with three homemade firebombs hurled,"" The Courier Mail (Australia), February 24, 2014.","""Signs Of Life In Australia : A Chronology of Recent Anarchist & Anti-Colonial Activity Down Under,"" 325, May 7, 2014.","","START Primary Collection",-9,-9,0,-9,""
"33",201405180095,2014,5,18,"",0,"",14,"Australia",12,"Australasia & Oceania","New South Wales","Sydney",-33.888408,151.237218,1,0,"The incident occurred in the Woollahra neighborhood of the city.","05/18/2014: Assailants set fire to two vehicles on Queen street in Woollahra neighborhood, Sydney city, New South Wales state, Australia. There were no reported casualties in the attack. This was one of two coordinated attacks carried out by the Informal Anarchist Federation in Woollahra neighborhood on May 18, 2014. The Informal Anarchist Federation claimed responsibility for the incident, stating that the attack was carried out in retaliation to injustice.",1,1,1,0,NA,".",1,1,0,7,"Facility/Infrastructure Attack",NA,".",NA,".",14,"Private Citizens & Property",73,"Vehicles/Transportation","Not Applicable","Luxury Vehicles",14,"Australia",NA,".",NA,".","","",NA,".",NA,".",NA,".","","",NA,".","Informal Anarchist Federation","","","","",20203,NA,NA,"","The Informal Anarchist Federation claimed responsibility for the incident and stated that the attack was carried out in retaliation to injustice.",0,NA,NA,-99,0,1,7,"Posted to website, blog, etc.",NA,NA,".",NA,NA,".",NA,8,"Incendiary",18,"Arson/Fire",NA,".",NA,".",NA,".",NA,".",NA,".",NA,".","",0,0,0,0,0,0,1,3,"Minor (likely < $1 million)",-99,"Three luxury vehicles were damaged in this attack.",0,NA,NA,NA,NA,"","",NA,NA,NA,NA,NA,"",NA,".",NA,"","""Luxury cars destroyed in random attacks in Woollahra,"" The Daily Telegraph (Australia), May 19, 2014.","""FAI militants set fire to three vehicles in Australia's New South Wales.,"" Jane's, June 10, 2014.","""Sydney : 3 Luxury Cars Torched By FAI/IRF (Australia),"" 325, May 19, 2014.","START Primary Collection",1,1,0,1,"201405180096"
